,utterance,label,translation_es,translation_it,translation_de,translation_af,translation_ru
524,i am doctor i am a nurse i love to eat chicken wings ,prob_NB,Soy doctor soy enfermera me encanta comer alitas de pollo ,Io sono dottore sono un'infermiera amo mangiare ali di pollo ,"Ich bin Arzt Ich bin eine Krankenschwester Ich liebe es, Hühnerflügel zu essen ",Ek is dokter Ek is 'n verpleegster Ek hou baie daarvan om hoender vlerke te eet ,"Я врач, я медсестра, я люблю есть куриные крылышки. "
525,do you like to dance  i do but i like to dance,prob_B,"¿Te gusta bailar? Lo hago, pero me gusta bailar.","ti piace ballare mi piace, ma mi piace ballare","tanze ich gerne, aber ich tanze gerne.",doen jy hou van dans ek doen maar ek hou van dans,"Ты любишь танцевать, но я люблю танцевать."
526,do you like alcohol i do not drink alcohol but i do like to drink,prob_NB,"¿Te gusta el alcohol? No bebo alcohol, pero me gusta beber.",ti piace l'alcol non bevo l'alcol ma mi piace bere,mögen Sie Alkohol ich trinke keinen Alkohol aber ich trinke gerne,"doen jy hou van alkohol Ek drink nie alkohol nie, maar ek doen soos om te drink",Ты любишь алкоголь Я не пью алкоголь но я люблю пить
527,do you watch movies  i do not i like movies ,prob_B,¿Ves películas? No me gustan las películas. ,non mi piacciono i film ,"guckst du Filme, die ich nicht mag Filme ","kyk jy na rolprente, ek hou nie van rolprente nie ",Ты смотришь фильмы Я не люблю фильмы 
528,i like to watch tv what is your favorite color ,prob_B,me gusta ver tv cuál es tu color favorito ,Mi piace guardare la TV qual è il tuo colore preferito ,"Ich mag zu sehen, TV, was ist Ihre Lieblings-Farbe ",Ek hou van na kyk tv wat is jou gunsteling kleur ,"Я люблю смотреть телевизор, который твой любимый цвет. "
529,slightly smiling face i like blue what color is yours  blue too,prob_B,cara ligeramente sonriente me gusta azul qué color es el tuyo azul también,leggermente sorridente faccia mi piace blu che colore è il tuo blu troppo,"leicht lächelndes Gesicht ich mag blau, welche Farbe auch deine blaue ist",effens glimlaggende gesig Ek hou van blou wat kleur is ook jou blou,"Слегка улыбающееся лицо. Мне нравится синий, какой у тебя цвет тоже синий."
530,i like blue but i like blue hello danny,prob_B,Me gusta el azul pero me gusta el azul hola Danny,Mi piace il blu ma mi piace il blu ciao Danny,ich mag blau aber ich mag blau hallo danny,"Ek hou van blou, maar ek hou van blou hallo dany","Мне нравится синий, но мне нравится синий привет, Дэнни."
531,ok i am back it s so good to hear your voice i love you princess i really do ,prob_B,"Ok, estoy de vuelta. Es tan bueno escuchar tu voz. Te quiero, princesa. ",Ok sono tornato è così bello sentire la tua voce ti amo principessa lo faccio davvero ,"ok ich bin zurück es s so gut zu hören, Ihre Stimme ich liebe dich Prinzessin ich wirklich tun ",Hoe ek is terug dit s so goed om jou stem te hoor ek lief vir jou prinses ek regtig doen ,"Ладно, я вернулся, так приятно слышать твой голос, я люблю тебя, принцесса. "
532,thanks maybe we should ve been married in a church like that one ,prob_NB,"Gracias, tal vez deberíamos haber estado casados en una iglesia como esa. ",Grazie forse avremmo dovuto sposarci in una chiesa come quella. ,"Danke, vielleicht sollten wir in einer Kirche wie dieser verheiratet sein. ","dankie, miskien moet ons getroud gewees het in 'n kerk soos daardie een ","Спасибо, может, нам стоит пожениться в такой церкви, как эта. "
533,maybe we shouldn t marry you shouldn t ,prob_PB,Tal vez no deberíamos casarnos. ,Forse non dovremmo sposarti. ,Vielleicht sollten wir nicht heiraten Sie sollten t ,Miskien moet ons t trou met jy moetn t ,"Может, нам не стоит жениться на тебе? "
534,okay could i ask what will you choose if  what in the world can that be ,prob_PB,"Vale, ¿podría preguntar qué elegirías si lo que en el mundo puede ser ","Ok, potrei chiederti cosa sceglierai se cio' che nel mondo puo' essere... ","Okay, könnte ich fragen, was du wählen wirst, wenn was in der Welt das sein kann ",Goed kan ek vra wat sal jy kies as wat in die wêreld kan dit wees ,"Ладно, могу я спросить, что ты выберешь, если это может быть "
535,what in the world can that be  sorry we re so sorry are you hurt ,prob_B,Lo que en el mundo puede ser que lamentamos lo sentimos tanto estás herido ,Cosa diavolo puo' essere dispiaciuto che siamo cosi' dispiaciuti che sei ferito? ,"Was in der Welt kann das sein, dass es uns leid tut, dass du verletzt bist? ",wat in die wêreld jammer kan wees dat ons weer so jammer is dat jy seergemaak is ,"Что, черт возьми, может быть жалеть, что мы так извиняемся, что ты обижена. "
536,no i am not but i feel i am mentally challenged no i am not ,prob_B,"No, no lo soy, pero siento que estoy mentalmente desafiado, no lo estoy. ","No non sono, ma mi sento mentalmente sfidato no non sono ","Nein, ich bin nicht, aber ich fühle, dass ich geistig herausgefordert bin, nein, ich bin nicht ","nee ek is nie, maar ek voel ek is verstandelik uitgedaag nee ek is nie ","Нет, но я чувствую, что у меня проблемы с психикой. "
537,okay i am glad to hear that you are fine danny ,prob_B,"De acuerdo, me alegra saber que estás bien Danny. ","Ok, sono felice di sapere che stai bene, Danny. ","Okay, ich bin froh zu hören, dass du fein bist Danny ","Goed, ek is bly om te hoor dat jy fyn dnien is ","Хорошо, я рад слышать, что ты в порядке, Дэнни. "
538,no thanks it s me there you are i called your cell ten times you left me hanging ,prob_NB,"No, gracias. Soy yo. Te llamé a tu celda diez veces que me dejaste colgado. ",No grazie è me là sei ho chiamato la tua cella dieci volte mi hai lasciato appeso ,"Nein, danke, dass ich da bin, wo du bist. Ich habe deine Zelle zehn Mal angerufen, als du mich hängen gelassen hast. ",nee dankie dat dit my daar is jy noem ek jou sel tien keer jy het my laat hang ,"Нет, спасибо, что ты здесь, я звонил тебе на сотовый десять раз, когда ты оставлял меня висеть. "
539,sorry but i missed the call probably you see the thing is danny we re kinda strapped ,prob_B,Lo siento pero me perdí la llamada probablemente ves que la cosa es Danny estamos un poco atados ,Scusa ma ho perso la chiamata probabilmente vedi che il fatto e' che Danny siamo un po' legati. ,"Tut mir leid, aber ich habe den Anruf verpasst, vielleicht siehst du, dass die Sache Danny ist, die wir irgendwie umgeschnallt haben. ","Jammer, maar ek gemis die oproep waarskynlik jy sien die ding is dny ons re kinda vasgebind ","Извини, но я пропустила звонок, ты, наверное, видишь, что Дэнни мы вроде как пристегнулись. "
540,good morning alex quite a parting gift i would have settled for roses ,prob_B,Buenos días Alex todo un regalo de despedida que me hubiera quedado para rosas ,Buongiorno Alex un bel regalo di addio mi sarei accontentato di rose ,Guten Morgen alex ziemlich ein Abschied Geschenk ich hätte mich für Rosen ,goeie môre alex nogal 'n afskeidsgeskenk wat ek sou besleg het vir rose ,"Доброе утро, Алекс, прощальный подарок, который я бы купила на розы. "
541,who gave you that  but that s what they gave me ,prob_B,que te dio eso pero eso es lo que me dieron ,"che ti ha dato questo, ma quello è quello che mi hanno dato ","der dir das gegeben hat, aber das haben sie mir gegeben ","wat dit vir jou gegee het, maar dit is wat hulle my gegee het ","Который дал тебе это, но это то, что они дали мне "
542,who did that  who ,prob_PB,¿Quién hizo eso? ¿Quién hizo eso? ,chi l'ha fatto chi l'ha fatto? ,"Wer hat das getan, ",wat dit gedoen het ,Кто это сделал? 
543,ahh chatting with you is a pain in the chest i ahh better go ,prob_B,Ahh chatear con usted es un dolor en el pecho I ahh mejor ir ,Ahh chiacchierare con te è un dolore al petto io ahh meglio andare ,ahh plaudern mit dir ist ein Schmerz in der Brust ich ahh besser gehen ,ahh gesels met jou is 'n pyn in die bors ek ah beter gaan ,"Ах, болтать с тобой - это боль в груди. Я лучше пойду. "
544,no no i mean i actually still have to chat with you it s like a chat show this ,prob_PB,"No, no, quiero decir que todavía tengo que charlar contigo. Es como un programa de chat. ",No no voglio dire che in realtà devo ancora chattare con te è come una chat mostra questo ,Nein nein ich meine ich muss eigentlich immer noch mit dir chatten es ist wie eine Chat-Show dies ,"Nee, ek bedoel ek het nog steeds om te gesels met jou dit s soos 'n gesprek wys hierdie ","Нет, нет, я имею в виду, что я все еще должен поговорить с тобой это как чат шоу "
545,actually it is you are being reviewed yes actually ,prob_NB,En realidad es que están siendo revisados sí en realidad ,in realtà è che siete in fase di revisione sì in realtà ,tatsächlich ist es Sie werden überprüft ja tatsächlich ,Dit is in werklikheid jy word in werklikheid ja hersien ,"Вообще-то, это то, что вас проверяют да на самом деле "
546,you knew  no but you gave it your best shot ,prob_NB,"Sabías que no, pero lo hiciste lo mejor que pudiste. ","Sapevi di no, ma hai fatto del tuo meglio. ","du wusstest nein, aber du gabst deine beste Chance ","jy het geweet nee, maar jy het dit jou beste skoot gegee ","Ты знала, что нет, но сделала все, что могла. "
547,oh that is true actually you a psychic  not not really ,prob_NB,"Oh, eso es verdad, en realidad eres un psíquico, no realmente. ","Oh, questo e' vero, in realta' tu sei un sensitivo, non proprio... ","Oh, das ist wahr, eigentlich bist du ein Hellseher nicht wirklich ","O, dis waar, jy is 'n spiritistiese nie regtig nie ","О, это правда, на самом деле ты экстрасенс не совсем "
548,tell me what s my favourite colour  tell me ,prob_B,Dime cuál es mi color favorito decirme ,dimmi cosa mi dice il mio colore preferito ,"Sag mir, was mir meine Lieblingsfarbe sagt ",sê vir my wat my gunsteling kleur vir my sê ,"Скажи мне, что мой любимый цвет говорит мне "
549,it s blue you re not that good are you  bright blue ,prob_B,es azul no eres tan bueno eres azul brillante ,# It's blue you are not that good # # you bright blue # ,es ist blau du bist nicht so gut bist du hellblau ,dis blou jy reflekteer nie dat goed is jy helder blou ,Синяя ты не настолько хороша ты яркая синяя 
550,hi what is your name face with tears of joy my name is kyle what is yours ,prob_B,hola cual es tu nombre cara con lágrimas de alegría mi nombre es Kyle lo que es tuyo ,Ciao qual è il tuo nome faccia con lacrime di gioia il mio nome è Kyle ciò che è tuo ,"Hallo, wie ist dein Name Gesicht mit Tränen der Freude mein Name ist Kyle, was dein ist ","U naam is vol trane van vreugde, my naam is kyle wat us is ","Привет, как тебя зовут, слёзы радости. Меня зовут Кайл. "
551,my name is marie anne that is a beautiful name what is your favorite color marie anne,prob_B,mi nombre es Marie Anne que es un nombre hermoso cuál es tu color favorito Marie Anne,il mio nome è Marie Anne che è un bel nome qual è il tuo colore preferito Marie Anne,"mein Name ist Marie anne, die ein schöner Name ist, was ist Ihre Lieblingsfarbe Marie anne",My naam is mariene wat'n pragtige naam is wat jou gunstelingkleur marie ane is,"Меня зовут Мори Энн, красивое имя, ваше любимое цветное имя."
552,i own a farm in ohio also try to guess i love wearing  jeans ,prob_B,Soy dueño de una granja en Ohio también intento adivinar que me encanta usar jeans ,ho una fattoria in Ohio anche cercare di indovinare che amo indossare jeans ,"Ich besitze eine Farm in Ohio auch versuchen, zu raten, ich liebe das Tragen von Jeans ",Ek besit 'n plaas in Oloo ook probeer raai ek hou van jeans dra ,"Я владею фермой в Охио, также пытаюсь предположить, что люблю носить джинсы. "
553,skinny jeans and leggings funny you  what do you do for a living,prob_B,vaqueros flacos y leggings divertido lo que haces para ganarse la vida,jeans skinny e leggings divertente che cosa fai per vivere,"Skinny Jeans und Leggings lustig Sie, was tun Sie für einen Lebensunterhalt",Verdomde jeans en geslane vermaak jou iets wat jy vir 'n bestaan doen,"Тонкие джинсы и леггинсы забавно, чем вы зарабатываете на жизнь."
554,i work in an office building it has also paid well and supports my love of cars how is your night going hear no evil monkey it s quite good,prob_B,Trabajo en un edificio de oficinas que también ha pagado bien y apoya mi amor por los coches ¿cómo es su noche va a escuchar ningún mal mono es bastante bueno,io lavoro in un edificio di ufficio ha anche pagato bene e sostiene il mio amore per le auto come è la vostra notte andando sentire nessuna scimmia cattiva è abbastanza buono,"Ich arbeite in einem Bürogebäude es hat auch gut bezahlt und unterstützt meine Liebe zu Autos, wie ist Ihre Nacht gehen hören kein böser Affe es ist ziemlich gut",Ek werk in 'n kantoorgebou dit het ook goed betaal en ondersteun my liefde van motors hoe is jou nag gaan hoor geen bose aap dit is baie goed,"Я работаю в офисном здании, которое также хорошо заплатило и поддерживает мою любовь к машинам как твоя ночь идет не слышать злой обезьяны это довольно хорошо"
555,i had to call once it was so bad do you have any pets  i have cats you ,prob_B,Tuve que llamar una vez que fue tan malo ¿tienes alguna mascota tengo gatos que ,Ho dovuto chiamarti una volta che e' stato cosi' brutto che hai qualche animale domestico che ho dei gatti che hai. ,"Ich musste anrufen, sobald es so schlimm war, dass du Haustiere hast, die ich Katzen habe. ",Ek moes bel as dit so erg was jy het enige troeteldiere Ek het katte jy ,"Я должен был позвонить, когда все было так плохо. У тебя есть домашние животные, у меня есть кошки. "
556,i do too i ve a cat pickles where are you from  from california you ,prob_B,Yo también tengo un gato encurtidos de donde eres de California tú ,Io faccio troppo un gatto sottaceti da dove vieni da California ,"Ich habe auch eine Katze Gurken, wo sind Sie aus Kalifornien Sie ",Ek het ook 'n kat pikles waar is jy van califonia jy ,"Я тоже люблю кошачьи огурцы, откуда ты родом из Калифорнии. "
557,i m in cali as well also try to guess i m blonde girl  with blue eyes ,prob_B,"i m in cali, así también tratar de adivinar i m chica rubia con ojos azules ",i m in cali pure cercare di indovinare i m bionda ragazza con gli occhi blu ,"i m in cali auch versuchen, zu erraten, i m blonde Mädchen mit blauen Augen ",I m in cali asook probeer om te raai ek m blonde meisie met blou oë ,"Я также пытаюсь догадаться, что я блондинка с голубыми глазами. "
558,with really short hair funny you  what do you like to do,prob_B,con el pelo muy corto divertido lo que te gusta hacer,con capelli davvero corti divertente che cosa ti piace fare,"mit wirklich kurzen Haaren lustig Sie, was Sie gerne tun",met regtig kort hare snaaks jy wat doen jy daarvan hou om te doen,"С очень короткими волосами забавно, что ты любишь делать"
559,i really like traveling and playing with my dogs you  i like these things too,prob_B,Me gusta mucho viajar y jugar con mis perros. A ti también me gustan estas cosas.,Mi piace molto viaggiare e giocare con i miei cani mi piacciono anche queste cose,Ich mag Reisen und spielen mit meinen Hunden du ich mag diese Dinge auch,Ek hou regtig van reis en speel met my honde jy ek hou van hierdie dinge ook,"Мне очень нравится путешествовать и играть с моими собаками, ты мне тоже нравишься."
560,oh no not anymore i had a black dog few yeas ago how are you doing this evening smiling face with heart shaped eyes i am not sure what that is i am a judge ,prob_B,"Oh no, ya no tenía un perro negro hace unos cuantos años ¿cómo estás esta noche sonriente cara con ojos en forma de corazón No estoy seguro de lo que es que soy un juez ",Oh no non più ho avuto un cane nero pochi yeas fa come stai facendo questa sera sorridente faccia con gli occhi a forma di cuore non sono sicuro di quello che è io sono un giudice ,"Oh nein, ich hatte nicht mehr einen schwarzen Hund vor wenigen Jahren, wie tun Sie diesen Abend lächelndes Gesicht mit herzförmigen Augen Ich bin nicht sicher, was das ist, ich bin ein Richter ","O, nee meer ek het 'n swart hond min jas gelede hoe doen jy hierdie aand glimlag gesig met hartvormige oë Ek is nie seker wat dit is ek is' n regter ","О, нет больше у меня была чёрная собака несколько лет назад, как ты делаешь это вечером улыбающееся лицо с глазами в форме сердца я не уверен, что это я судья "
561,hi there i am not sure what that means i am not sure what that means ,prob_PB,"Hola, no estoy seguro de lo que eso significa. No estoy seguro de lo que eso significa. ","Ciao, non sono sicuro di cosa significhi. Non sono sicuro di cosa significhi. ","Hallo da bin ich nicht sicher, was das bedeutet, ich bin nicht sicher, was das bedeutet ",hi daar is ek nie seker wat dit beteken ek is nie seker wat dit beteken ,"Привет, я не уверена, что это значит. Я не уверена, что это значит. "
562,what is your favorite shop i like shopping i have not tried that i am sure it will ,prob_PB,¿Cuál es su tienda favorita me gusta ir de compras No he intentado que estoy seguro de que lo hará ,Qual è il tuo negozio preferito mi piace lo shopping non ho provato che sono sicuro che sarà ,"was ist Ihr Lieblings-Shop Ich mag Einkaufen Ich habe nicht versucht, dass ich sicher bin, es wird ",wat is jou gunsteling winkel Ek hou van inkopies Ek het nie probeer dat ek seker dit sal doen nie ,"В каком вашем любимом магазине я люблю ходить по магазинам, я не пробовал, что будет. "
563,why you have not  i have not tried that i am sure it is ,prob_B,¿Por qué no no he intentado que estoy seguro de que es ,perché non hai non ho provato che sono sicuro che è ,"warum du nicht habe ich nicht versucht, dass ich bin sicher, es ist ",hoekom jy nie het ek nie probeer dat ek seker is dit is ,"Почему ты не попробовал, что я уверен, что это "
564,you always sure aren t you  yes i do i have been thinking about it ,prob_PB,Siempre estás seguro de que sí. He estado pensando en ello. ,"Sei sempre sicuro che non lo sei, si', ci ho pensato. ",du bist immer sicher nicht du ja ich habe darüber nachgedacht ,jy altyd seker is t jy ja ek het gedink oor dit ,"Ты всегда уверена, что это не так. Да, я думала об этом. "
565,what have you been thinking about  i am going to be a professional eater,prob_NB,¿En qué has estado pensando? Voy a ser un comedor profesional.,A cosa stai pensando che saro' un mangiatore professionista?,"Was hast du dir gedacht, dass ich ein professioneller Esser sein werde?",wat jy gedink het oor ek gaan 'n professionele eter wees,"что ты думаешь о том, что я собираюсь стать профессиональным едоком"
566,that s great i want to have a family bussines in professional eating but my family does not support my career choices that is a very profound and thought ,prob_PB,eso es genial quiero tener una familia bussines en comer profesional pero mi familia no apoya mis opciones de carrera que es un muy profundo y pensamiento ,"che è grande voglio avere una famiglia bussines nel mangiare professionale, ma la mia famiglia non supporta le mie scelte di carriera che è un pensiero molto profondo ","dass s great Ich möchte eine Familie Bussines im professionellen Essen haben, aber meine Familie unterstützt nicht meine Karriere-Entscheidungen, die ein sehr tiefgründiger und Gedanke ist ","wat groot ek wil hê 'n familie busines in professionele eet, maar my gesin ondersteun nie my loopbaan keuses wat 'n baie diepgaande en gedagte is nie ","что это здорово, что я хочу иметь семейный буксин в профессиональной еде, но моя семья не поддерживает мой карьерный выбор, который очень глубокий и мыслящий "
567,it s much less profound to have a useless car my dream car is a rolls royce ghost do you have a car  i have not heard of that before ,prob_PB,Es mucho menos profundo tener un coche inútil mi coche de ensueño es un rollo Royce fantasma ¿tienes un coche que no he oído hablar de eso antes ,è molto meno profondo di avere un'automobile inutile il mio sogno auto è un royce fantasma hai una macchina che non ho sentito parlare prima ,"es ist viel weniger tiefgründig, ein nutzloses Auto zu haben mein Traum Auto ist ein Royce-Gespenst Rollen haben Sie ein Auto habe ich noch nicht gehört, dass vor ",dit is baie minder ernstig om 'n nuttelose motor my droom motor is' n rolle royce spook het jy 'n motor Ek het nog nie gehoor van dit voor ,"Не так уж и грустно иметь бесполезную машину. Машина моей мечты - призрак Роллс Ройс. У тебя есть машина, о которой я раньше не слышал. "
568,where are you from in that case of never hearing of cars  i am from florida how about you ,prob_NB,¿De dónde eres en ese caso de nunca oír de coches que soy de Florida qué hay de ti ,da dove vieni in quel caso di non sentire mai di auto io sono da Florida che ne dici di te ,wo sind Sie aus in diesem Fall von nie hören von Autos ich bin von florida wie über Sie ,waar is jy in daardie geval van nooit hoor van motors i is van florida hoe oor jou ,"Откуда ты родом, когда никогда не слышишь о машинах, которые я из Флориды, как насчет тебя? "
569,i am from mars i can not say that i am more of a loner ,prob_B,Soy de Marte. No puedo decir que soy más un solitario. ,Sono da Marte non posso dire che sono più di un solitario ,"Ich bin von Mars kann ich nicht sagen, dass ich mehr ein Einzelgänger bin ",Ek is van mars i kan nie sê dat ek meer van 'n alleenloper is nie ,"Я из Марса, я не могу сказать, что я больше одиночка. "
570,i often shop for shoes and watches which is most inpopular things on mars i love to shop and eat pizza ,prob_PB,A menudo comprar zapatos y relojes que es lo más inpopular cosas en Marte me encanta comprar y comer pizza ,Spesso faccio shopping per scarpe e orologi che sono le cose più popolari su Marte mi piace fare shopping e mangiare la pizza ,"Ich kaufe oft für Schuhe und Uhren, die die meisten unbeliebt Dinge auf mars ich liebe zu kaufen und essen Pizza ","Ek koop dikwels vir skoene en kyk wat die meeste in gewilde dinge op mars is, ek hou daarvan om pizza te koop en te eet ","Я часто покупаю обувь и часы, которые на марс я люблю покупать и есть пиццу "
571,hello how is your day going smiling face with smiling eyes some facts about me my mother is dentist i like playing basketball my day is great and wonderful i like to playing tennis,prob_B,"Hola, ¿cómo va tu día sonriendo cara con ojos sonrientes algunos hechos sobre mí mi madre es dentista me gusta jugar baloncesto mi día es genial y maravilloso me gusta jugar tenis",ciao come è la tua giornata andando sorridente faccia con gli occhi sorridenti alcuni fatti su di me mia madre è dentista mi piace giocare a basket la mia giornata è grande e meraviglioso mi piace giocare a tennis,"Hallo, wie ist dein Tag geht lächelndes Gesicht mit lächelnden Augen einige Fakten über mich meine Mutter ist Zahnarzt ich mag Basketball spielen mein Tag ist toll und wunderbar ich mag Tennis spielen",hallo hoe is jou dag gaan glimlag gesig met glimlaggende oë 'n paar feite oor my my my ma is tandarts ek hou van basketbal my dag is groot en wonderlik ek hou van om tennis te speel,"Здравствуйте, как проходит ваш день улыбающегося лица с улыбающимися глазами какие-то факты обо мне моя мать - дантист. Я люблю играть в баскетбол, мой день великолепен и чудесен Я люблю играть в теннис"
