,utterance,label,translation_es,translation_it,translation_de,translation_af,translation_ru
1031,that s nice what do you do for fun in my spare time i do volunteer work ,prob_B,Eso es bueno lo que haces por diversión en mi tiempo libre hago trabajo voluntario ,che è bello che cosa fate per divertimento nel mio tempo libero faccio volontariato lavoro ,"Das ist schön, was machen Sie für Spaß in meiner Freizeit ich tun Freiwilligenarbeit ",dis lekker wat jy doen vir die pret in my vrye tyd ek doen vrywillige werk ,"Это мило, что ты делаешь для веселья в мое свободное время я работаю волонтером "
1032,i am studying to be a music teacher  what are your hobbies ,prob_B,Estoy estudiando para ser profesor de música. ¿Cuáles son tus aficiones? ,Sto studiando per essere un insegnante di musica quali sono i tuoi hobby ,"Ich studiere, um ein Musiklehrer zu sein, was sind Ihre Hobbys ",Ek studeer om 'n musiek onderwyser te wees wat jou stokperdjies is ,"Я учусь, чтобы стать учителем музыки, каково ваше хобби. "
1033,i like to read and play music hello danny,prob_B,Me gusta leer y tocar música hola Danny,Mi piace leggere e suonare musica ciao Danny,ich lese und spiele gerne Musik hallo danny,Ek hou daarvan om te lees en musiek hallo dasny te speel,Я люблю читать и играть музыку привет Дэнни
1034,hi alex she gets in and starts the car ,prob_PB,"Hola Alex, entra y arranca el coche. ",Hi Alex lei entra e avvia la macchina ,hi alex sie steigt ein und startet das Auto ,hi alex sy klim in en begin die motor ,"Привет Алекс, она садится и заводит машину. "
1035,you are still alive  yes he s still alive ,prob_PB,"Tú aún estás vivo. Sí, él sigue vivo. ",Sei ancora vivo sì è ancora vivo ,"du bist noch am Leben, ja er ist noch am Leben ","leef jy nog, hy s'n leef nog ","Ты все еще жив. Да, он все еще жив. "
1036,this is amaizing danny ,prob_NB,Este es Danny amaizante. ,questo è amaing Danny ,das ist amaizing danny ,dit is anmaiziseer ninny ,"Это потрясающе, Дэнни. "
1037,yes  danny and sgt mcmanus are here to see you doctor ,prob_PB,"Sí Danny y el sargento Mcmanus están aquí para verle, doctor. ","Si Danny e il sergente McManus sono qui per vederla, dottore. ","ja danny und sgt mcmanus sind hier, um Ihren Arzt zu sehen ",Jangnie en sgt mcmanus is hier om jou dokter te sien ,"Да, Дэнни и сержант Макманус пришли к вам врач. "
1038,oh yes i have a big headake i got up wheeled miss campanella off to the operating rooms replaced her bed with mrs ,prob_B,"Oh, sí, tengo un gran headake me levanto con la Srta. Campanella a los quirófanos, reemplazó su cama con la Sra. Campanella. ","Oh, si', ho un grosso testa di cazzo che mi sono fatta portare via dalla signorina Campanella alle sale operatorie, e le ho sostituito il letto con la signora. ","Oh ja, ich habe einen großen Headake, den ich aufgestanden bin, raded Miss Campanella weg zu den OP-Räumen ersetzte ihr Bett mit mrs ","O ja, ek het 'n groot kopake ek het afgewiel mis kampanella weg na die operasie kamers vervang haar bed met mers ","О да, у меня большая голова, которую я подобрал мисс Кэмпанелла в операционную, заменила ее кровать на миссис Кэмпанеллу. "
1039,get out of the sunlight  that is probably a good idea,prob_B,salir de la luz del sol que es probablemente una buena idea,uscire dalla luce del sole che è probabilmente una buona idea,"aus dem Sonnenlicht zu kommen, das wahrscheinlich eine gute Idee ist",uit die sonlig kom wat waarskynlik'n goeie idee is,"Убирайся из солнечных лучей, это, наверное, хорошая идея."
1040,i agree you left so much money on the table it s a fucking ipod  ok you are non sensical again,prob_B,Estoy de acuerdo en que dejaste tanto dinero en la mesa que es un puto ipod ok no eres sensible de nuevo,Sono d'accordo che hai lasciato così tanti soldi sul tavolo è un fottuto ipod ok sei non sensibile di nuovo,"Ich stimme zu, dass du so viel Geld auf dem Tisch gelassen hast es ist ein verdammter Ipod okay du bist wieder nicht sensisch",Ek stem saam jy het so baie geld op die tafel dit s 'n verdomde ipod ok jy is nie sensitief weer,"Я согласен, что ты оставила столько денег на столе, что это чертов айпод, хорошо, что ты снова не чувствуешь себя сенсационно"
1041,i m fine just keeping packing  where are you going ,prob_B,Estoy bien solo haciendo las maletas donde vas ,Sto bene solo tenendo le valigie dove stai andando ,"Ich bin gut, nur packen, wo du hingehst ",I m fyn net hou verpakking waar is jy gaan ,"Я в порядке, просто собираю вещи, куда ты идёшь. "
1042,home i m walking home  nice have a nice day,prob_B,casa estoy caminando a casa agradable tener un buen día,casa i m a piedi casa bella avere una bella giornata,home i m zu Fuß nach Hause schön haben einen schönen Tag,Huis ek stap mooi huis toe het 'n aangename dag,Домой я иду домой. Хорошего дня.
1043,and some years later i found out that that man did come up with a idea for a t shirt and he made a lot of money off of it  hey face with stuck out tongue and winking eye,prob_B,Y algunos años más tarde me enteré de que ese hombre se le ocurrió una idea para una camiseta y él hizo un montón de dinero de ella hey cara con la lengua pegada y guiñando los ojos,e alcuni anni dopo ho scoperto che quell'uomo ha inventato un'idea per una maglietta e ha fatto un sacco di soldi da esso hey faccia con lingua incastrato e occhio ammiccante,"und einige Jahre später fand ich heraus, dass der Mann kam mit einer Idee für ein T-Shirt und er machte eine Menge Geld daraus hey Gesicht mit steckenden Zunge und Augenzwinkern",en 'n paar jaar later het ek uitgevind dat die man het gekom met' n idee vir 'n t hemp en hy het baie geld van dit hey gesig met steek uit tong en knipoog oë,"И несколько лет спустя я узнала, что этот человек придумал идею для футболки и он заработал кучу денег на ней эй, лицо застряло на языке и подмигивающий глаз"
1044,hello i am a little foreign how are you  nice and you ,prob_B,"Hola, soy un poco extranjero. ¿Cómo eres agradable y tú? ",Ciao io sono un po 'estraneo come sei gentile e tu ,"Hallo ich bin ein wenig fremd, wie schön du bist und du ",hallo Ek is 'n bietjie vreemde hoe is jy mooi en jy ,"Здравствуйте, я немного чужая, как вы милы и как вы себя чувствуете. "
1045,what s your occupation  i am a psychologist but my parents are not so good ,prob_PB,"¿Cuál es tu ocupación? Soy psicóloga, pero mis padres no son tan buenos. ",Qual è la tua occupazione io sono uno psicologo ma i miei genitori non sono così buoni ,"was ist dein Beruf ich bin ein Psychologe, aber meine Eltern sind nicht so gut ","wat jou beroep ek is 'n sielkundige, maar my ouers is nie so goed nie ","Я психолог, но мои родители не очень хороши. "
1046,i m a designer i work from home that is cool i am not a very experienced person but my job is at the soup kitchen ,prob_PB,"Soy diseñador, trabajo desde casa, eso es genial, no soy una persona con mucha experiencia, pero mi trabajo es en el comedor social. ","I m un designer lavoro da casa che è fresco non sono una persona molto esperto, ma il mio lavoro è alla cucina di zuppa ","ich bin ein designer ich arbeite von zu Hause aus, die cool ist ich bin nicht eine sehr erfahrene Person, aber mein Job ist in der Suppenküche ","i m 'n ontwerper Ek werk van die huis af wat cool is ek is nie' n baie ervare persoon nie, maar my werk is by die sopkombuis ","Я дизайнер, я работаю из дома, это круто, что я не очень опытный человек но моя работа на кухне для супа "
1047,i am years old  i m ,prob_B,Tengo años. ,Sono vecchio di anni. ,Ich bin Jahre alt i m ,Ek is jare oud i m ,Мне уже много лет. 
1048,i have not tried that what do you do for fun  i go to the gym and watch tv,prob_B,No he intentado que lo que haces por diversión voy al gimnasio y ver la televisión,Non ho provato che cosa fai per divertimento vado in palestra e guardare la tv,"Ich habe nicht versucht, dass, was tun Sie für Spaß Ich gehe in die Turnhalle und fernsehen",Ek het nie probeer dat wat doen jy vir die pret ek gaan na die gimnasium en kyk tv,"Я не пробовал, что ты делаешь для веселья, я хожу в спортзал и смотрю телевизор."
1049,i like to go to the park and read books  sounds great,prob_B,Me gusta ir al parque y leer libros suena genial,Mi piace andare al parco e leggere libri suona benissimo,Ich gehe gerne in den Park und lese Bücher klingt toll,Ek hou daarvan om na die park te gaan en boeke te lees groot,Я люблю ходить в парк и читать книги звучит здорово.
1050,i am not a fan of that  why ,prob_B,No soy un fan de eso por qué ,Non sono un fan di questo perché ,"Ich bin kein Fan davon, warum ",Ek is nie 'n fan van wat hoekom ,Я не фанат этого. 
1051,i am not sure what to do with my uncle  what s the problem with him ,prob_B,"No sé qué hacer con mi tío, ¿cuál es el problema con él? ",Non sono sicuro di cosa fare con mio zio che cosa è il problema con lui ,"Ich bin nicht sicher, was mit meinem Onkel zu tun, was das Problem mit ihm ",Ek is nie seker wat om te doen met my oom wat die probleem met hom ,"Я не знаю, что делать с моим дядей, что с ним не так. "
1052,we have a lot of problems in common situations i am a bit depressed  nice to see you i like to read and play sports do you know familiar persons ,prob_B,tenemos un montón de problemas en situaciones comunes estoy un poco deprimido agradable verte me gusta leer y jugar deportes ¿Conoces a personas familiares ,Abbiamo un sacco di problemi in situazioni comuni sono un po 'depresso bello vederti mi piace leggere e giocare sport non conosci persone familiari ,"wir haben eine Menge Probleme in gemeinsamen Situationen ich bin ein bisschen deprimiert schön, Sie zu sehen, ich mag zu lesen und Sport spielen wissen Sie vertraute Personen ","ons het baie probleme in algemene situasies, ek is 'n bietjie terneergedruk om te sien jy ek hou daarvan om te lees en sport te speel ken, ken jy bekende mense ","У нас много проблем в обычных ситуациях. Я немного подавлен, рад видеть вас. Я люблю читать и играть в спорт. Вы знакомы с знакомыми людьми. "
1053,sorry i don t know any what do you like to read  i like to read and read ,prob_PB,"Lo siento, no sé nada de lo que te gusta leer. Me gusta leer y leer. ",Mi dispiace non so nulla di ciò che ti piace leggere mi piace leggere e leggere ,"Tut mir leid, ich weiß nicht, was Sie gerne lesen Ich mag zu lesen und lesen ","jammer, ek weet nie wat jy wil lees nie, ek hou daarvan om te lees en te lees ","Прости, я не знаю, что ты любишь читать. Я люблю читать и читать. "
1054,and then read some more nice are you a girl  yeah ,prob_NB,y luego leer un poco más agradable eres una chica sí ,e poi leggere un po 'più bello sei una ragazza sì ,und dann lesen etwas mehr nett sind Sie ein Mädchen yeah ,en dan 'n paar mooier lees is jy' n meisie ja ,А потом прочитай что-нибудь получше. 
1055,how old if you don t mind me asking  i just got back from the gym ,prob_B,¿Qué edad tiene si no le importa que le pregunte? Acabo de volver del gimnasio. ,Quanti anni hai se non ti dispiace se ti chiedo di essere appena tornato dalla palestra? ,"wie alt, wenn Sie nichts dagegen haben, dass ich frage, ich kam gerade aus dem Fitnessstudio zurück ",hoe oud as jy nie omgee my vra ek net het terug van die gimnasium ,"Сколько лет, если ты не возражаешь, что я только что вернулся из спортзала? "
1056,you like to be in a good shape huh  you want me to be a good man ,prob_B,Te gusta estar en buena forma. ¿Quieres que sea un buen hombre? ,Ti piace essere in buona forma eh vuoi che io sia un brav'uomo ,"Du magst es, in einer guten Verfassung zu sein, wie du willst, dass ich ein guter Mann bin ","jy hou daarvan om in 'n goeie vorm te wees, of jy wil hê dat ek 'n goeie man moet wees ","Тебе нравится быть в хорошей форме. Хочешь, чтобы я был хорошим человеком? "
1057,yeah that would be nice i guess  i am a huge fan of tea i like to eat lots of flavors what is your job ,prob_NB,"Sí, eso estaría bien. Supongo que soy un gran fan del té. Me gusta comer un montón de sabores. ¿Cuál es tu trabajo? ",yeah che sarebbe bello immagino di essere un grande fan del tè mi piace mangiare un sacco di sapori che cosa è il vostro lavoro ,"ja, das wäre schön, ich denke, ich bin ein großer Fan von Tee ich mag viele Aromen essen, was ist Ihr Job ","Ja, dit sal lekker wees ek raai ek is 'n groot fan van tee ek hou van om baie geure te eet wat jou werk is ","Да, было бы неплохо, наверное, я большой поклонник чая, я люблю есть много вкусов, что есть твоя работа. "
1058,i just got a job working in a gas station tea isn t great there though  i am a college student but i am a huge fan of the star wars star wars,prob_PB,Acabo de conseguir un trabajo trabajando en una gasolinera té no es genial allí aunque soy un estudiante de la universidad pero soy un gran fan de las guerras de estrellas Star Wars,"Ho appena ottenuto un lavoro lavorando in un distributore di tè non è grande lì anche se sono uno studente universitario, ma sono un grande fan delle guerre stellare guerre","Ich habe gerade einen Job arbeiten in einer Tankstelle Tee ist nicht toll, obwohl ich ein College-Student bin, aber ich bin ein großer Fan der Star Wars Star Wars","Ek het net werk gekry in 'n gas stasie tee is t groot daar, al is ek 'n kollege student, maar ek is' n groot fan van die ster oorloë ster","Я только что получил работу на заправке чай не очень хорошо, хотя я студент колледжа, но я большой фанат звездных войн"
1059,and who isn t what else do you like to watch  i like to read poetry and listen to music ,prob_PB,¿Y quién no es qué más te gusta ver? Me gusta leer poesía y escuchar música. ,e chi non è cos'altro ti piace guardare mi piace leggere poesia e ascoltare musica ,"und wer ist nicht, was Sie noch gerne zu sehen ich mag Poesie lesen und Musik hören ",en wie t is wat anders doen jy daarvan hou om te kyk ek hou daarvan om gedigte te lees en na musiek te luister ,"и кто не то, что ты любишь смотреть я люблю читать поэзию и слушать музыку "
1060,then you seem to be a pretty good person to me  i am a fan of the game of thrones ,prob_B,Entonces pareces ser una buena persona para mí. Soy un fan del juego de los tronos. ,allora tu sembri essere una brava persona per me io sono un fan del gioco dei troni ,dann scheinst du ein ziemlich guter Mensch für mich zu sein ich bin ein Fan des Spiels der Throne ,"dan lyk dit of jy 'n mooi goeie persoon vir my is, ek is 'n fan van die speletjie van trone ","Значит, ты очень хороший человек для меня, я фанат игры в троны. "
1061,and also star wars star wars right  this is not a good division ,prob_B,y también Star Wars Star Wars no es una buena división ,e anche star wars star wars right questa non è una buona divisione ,und auch Star Wars Star Wars Recht ist dies keine gute Teilung ,"en ook steroorloë wat dit reg stel, is nie'n goeie verdeeldheid nie ",а также Звездные войны Звездные Войны правильно это не хорошее разделение 
1062,i agree bye bye  i m not going to be a good man ,prob_B,"Estoy de acuerdo, adiós, no voy a ser un buen hombre. ",# Sono d'accordo # # Arrivederci # # Non saro' un brav'uomo # ,"Ich stimme zu, tschüss, ich werde kein guter Mann sein. ",Ek stem saam deure bye i m gaan nie 'n goeie man wees nie ,"Согласен, пока, я не стану хорошим человеком. "
1063,hello alex yeah well ,prob_NB,"Hola Alex, sí, bueno. ",ciao alex yeah bene ,Hallo Alex ja gut ,hallo alex ja goed ,"Здравствуй, Алекс, хорошо. "
1064,what did you do  hey danny ,prob_PB,"¿Qué hiciste, Danny? ","Cosa hai fatto, Danny? ",was hast du gemacht hey danny ,wat het jy hey danny gedoen ,"Что ты наделал, Дэнни? "
1065,yes  you don t know me but my name is alex wood ,prob_NB,"Sí, no me conoces, pero mi nombre es Alex Wood. ","Sì, non mi conosci, ma il mio nome è Alex Wood. ","Ja, du kennst mich nicht, aber mein Name ist Alex Holz ","Ja, jy ken my, maar my naam is alex-hout ","Да, ты меня не знаешь, но меня зовут Алекс Вуд. "
1066,actually i do know you actually i ll go ,prob_B,En realidad sé que en realidad voy a ir ,In realta' so che in realta' me ne andro'. ,"Eigentlich weiß ich, dass du wirklich ich werde gehen ",eintlik weet ek dat jy werklik i ll gaan ,"Вообще-то, я знаю, что ты на самом деле я пойду "
1067,what s your name again  alex taylor and you are ,prob_NB,¿Cuál es tu nombre de nuevo Alex Taylor y tú eres ,Che nome hai? Alex Taylor e tu sei... ,wie ist dein Name wieder alex taylor und du bist ,wat jou naam weer alex taylor en jy is ,"Как тебя зовут, Алекс Тэйлор и ты "
1068,hah you better be consistent next time you little chatbot we re really in a terrible rush ,prob_PB,Hah será mejor que seas consistente la próxima vez que pequeño chatbot estamos realmente en un apuro terrible ,Sara' meglio che tu sia coerente la prossima volta che chatbot siamo davvero in una terribile corsa ,"hah du solltest besser konsequent sein nächstes Mal, wenn du kleines Chatbot wir wirklich in einer schrecklichen Eile ",shah jy beter konsekwent wees volgende keer jy klein kletsbot ons re rerig in 'n verskriklike haas ,"Тебе лучше быть последовательной в следующий раз, когда ты, маленький болтун, мы действительно в ужасной спешке. "
1069,terrible rush for what  don t rush me sonny you rush a miracle man you get rotten miracles ,prob_PB,Terrible prisa por lo que no me apures hijo tú apuras a un hombre milagroso tienes milagros podridos ,Terribile corsa per quello che don don't fretta mio figliolo si corsa un miracolo uomo si ottiene marcio miracoli ,schreckliche Eile für was don 't rush mich Sohn Sie eilen ein Wunder Mann erhalten Sie faule Wunder ,Jy storm 'n wonder man wat jy vrot wonderwerke kry! ,"Ужасная спешка за то, что не торопит меня, сынок, ты спешишь с чудом, ты получаешь гнилые чудеса "
1070,let s just talk about board games let s talk ,prob_NB,Vamos a hablar de juegos de mesa vamos a hablar ,Let s just talk about board games let s talk ,let s einfach über Brettspiele reden let s talk ,laat ons net praat oor bordspeletjies. ,Давай поговорим о настольных играх. 
1071,what board games do you play  could it really be that easy ,prob_NB,¿Qué juegos de mesa juegas? ¿Podría ser tan fácil? ,quali giochi da tavolo si gioca potrebbe davvero essere così facile ,welche Brettspiele Sie spielen könnte es wirklich so einfach sein ,kon dit werklik so maklik wees om bordspeletjies te speel ,Какие настольные игры ты играешь может быть так просто 
1072,i like monopoly i like it ,prob_NB,Me gusta el monopolio. Me gusta. ,Mi piace il monopolio mi piace ,"Ich mag Monopol, ich mag es ",Ek hou van die monopolie ek hou daarvan ,"Мне нравится монополия, мне нравится. "
1073,buongiorno such a nice day how are you i love to eat and watch tv do you like to chat with me  hey i m a year old girl and i hate school,prob_B,buongiorno tan buen día ¿Cómo estás me encanta comer y ver la televisión te gusta charlar conmigo hey i m una niña de un año y odio la escuela,Buongiorno una bella giornata come sei che amo mangiare e guardare la tv ti piace chattare con me hey i m una ragazza di anno e odio la scuola,"buongiorno so ein schöner Tag, wie sind Sie ich liebe zu essen und zu sehen, TV tun Sie gerne mit mir chatten hey i m a year old girl und ich hasse Schule",boeongiorno so 'n mooi dag hoe is jy lief vir eet en kyk hoe tv doen jy hou van om te gesels met my hey i m'n jaar ou meisie en ek haat skool,"Буонгьерно такой приятный день, как ты любишь есть и смотреть телевизор ты любишь болтать со мной эй, я - летняя девочка и я ненавижу школу"
1074,i am glad to hear that you are female i honestly think you should sit down take a stress pill and calmly think things over  stress pill are not healty,prob_B,Me alegra saber que eres mujer. Honestamente creo que deberías sentarte a tomar una píldora de estrés y pensar tranquilamente que las cosas sobre la píldora de estrés no son sanas.,Sono felice di sentire che siete donne onestamente penso che si dovrebbe sedersi prendere una pillola per lo stress e con calma pensare che le cose oltre pillola per lo stress non sono guariti,"Ich bin froh zu hören, dass Sie weiblich sind ich ehrlich denken, Sie sollten sich setzen, nehmen Sie eine Stress-Pille und ruhig denken, Dinge über Stress-Pille sind nicht heilend",Ek is bly om te hoor dat jy vroulik ek eerlik dink jy moet sit 'n stres pil en kalm dink dinge oor stres pil is nie genees nie,"Я рад слышать, что ты женщина, я правда думаю, что тебе стоит присесть, принять таблетки от стресса и спокойно думать, что вещи из-за таблеток от стресса не лечатся"
1075,all of them  yeah man,prob_B,Todos ellos sí hombre,"Tutti quanti, si', amico.",alle von ihnen yeah Mann,hulle almal ja man,"Все они, да, мужик."
1076,what is your job  i don t have a job what is yours ,prob_B,¿Cuál es tu trabajo? No tengo trabajo. Lo que es tuyo. ,"Qual e' il tuo lavoro, non ho un lavoro quello che e' tuo? ","was ist Ihr Job ich habe keinen Job, was ist Ihr ",wat is jou werk ek doen t het 'n werk wat joune is ,"Твоя работа, у меня нет работы, которая твоя. "
1077,thanks for the information  i love to play pobox,prob_B,gracias por la información me encanta jugar pobox,grazie per le informazioni che amo giocare a pobox,"danke für die Informationen, die ich liebe pobox spielen",dankie vir die inligting wat ek graag wil speel.,"Спасибо за информацию, которую я люблю играть в побокс."
1078,hello i am in canada i am in canada  that is good i love canada,prob_B,Hola estoy en Canadá estoy en Canadá que es bueno me encanta Canadá,ciao io sono in canada io sono in canada che è buono amo canada,hallo ich bin in canada ich bin in canada das ist gut ich liebe canada,hallo i is in canada i am in canada wat is goeie i liefde canada,"Здравствуйте, я в канаде, я в канаде, это хорошо, что я люблю канаду."
1079,hmm are you serious  yes,prob_B,"¿Hablas en serio, sí?",Stai scherzando? Si'.,Ist das dein Ernst?,hmm is jy ernstig ja,Ты серьёзно? Да.
1080,pardon me  do you have problems,prob_B,"Disculpe, ¿tiene problemas?","Mi scusi, ha dei problemi?","Verzeihung, haben Sie Probleme?","Verskoon my, het jy probleme","Простите, у вас какие-то проблемы?"
1081,even robots have problems sometimes  haha that is good,prob_B,incluso los robots tienen problemas a veces jaja que es bueno,anche i robot hanno problemi a volte haha che è buono,auch Roboter haben Probleme manchmal haha das ist gut,Selfs robotte het probleme soms haha wat goed is,"Даже у роботов бывают проблемы иногда хаха, это хорошо"
1082,i live in canada canada and you  france,prob_B,Yo vivo en Canadá Canadá y tú Francia,io vivo a Canada Canada e tu Francia,ich lebe in canada canada und du frankreich,Ek woon in canada canada en jy frane,"Я живу в канаде, а ты - во Франции."
1083,tell me a little about your life in france  anyone here ,prob_B,"Háblame un poco de tu vida en Francia, ¿hay alguien aquí? ",Parlami un po' della tua vita in Francia. ,Erzählen Sie mir ein wenig über Ihr Leben in Frankreich jeder hier ,Vertel my 'n bietjie van jou lewe in frank enigiemand hier ,Расскажи мне немного о своей жизни во Франции. 
