,utterance,label,translation_es,translation_it,translation_de,translation_af,translation_ru
1613,hi alex hi ,prob_NB,"Hola Alex, hola ",Hi Alex Hi ,hi alex hi ,hi alx hi ,"Привет, Алекс. "
1614,hi alex hi ,prob_NB,"Hola Alex, hola ",Hi Alex Hi ,hi alex hi ,hi alx hi ,"Привет, Алекс. "
1615,hi alex hi ,prob_NB,"Hola Alex, hola ",Hi Alex Hi ,hi alex hi ,hi alx hi ,"Привет, Алекс. "
1616,hi alex hi ,prob_NB,"Hola Alex, hola ",Hi Alex Hi ,hi alex hi ,hi alx hi ,"Привет, Алекс. "
1617,how is today  i m fine thanks ,prob_NB,¿Cómo es hoy estoy bien gracias ,come è oggi i m bene grazie ,Wie ist heute ich bin gut Dank ,hoe is vandag i m fyn dank ,"Как сегодня я в порядке, спасибо. "
1618,i slacked a lot today what ,prob_NB,Hoy aflojé mucho lo que ,Ho perso molto tempo oggi... ,"Ich habe heute viel nachgelassen, was ",Ek het vandag baie minder wat ,"Я сегодня сильно ослабила то, что "
1619, did you wish to see someone sir  no,prob_B," ¿Desea ver a alguien, señor?", Voleva vedere qualcuno signore no," Wollten Sie jemanden sehen, Sir?"," wou jy iemand sien, nee"," Вы хотели увидеть кого-то, сэр?"
1620,not it at all really  really i dont want to see any one,prob_B,No es en absoluto realmente no quiero ver a nadie,non è per niente davvero non voglio vedere nessuno,nicht es überhaupt wirklich wirklich ich will keins sehen,nie op alle werklik ek wil enige een sien nie,"Вообще-то, я не хочу никого видеть."
1621,i want to see i want to see  who would you like to see ,prob_B,Quiero ver a quién te gustaría ver. ,Voglio vedere chi vuoi vedere. ,"Ich will sehen, wen du gerne sehen möchtest. ",Ek wil sien ek wil sien wie wil jy graag sien ,"Я хочу посмотреть, кого ты хочешь увидеть. "
1622,your master s ships going home  what ,prob_B,sus barcos de patrón ir a casa lo que ,le navi del tuo padrone che tornano a casa cosa ,"Ihr Meister s Schiffe nach Hause gehen, was ",jou meesterskepe gaan huis toe wat ,Ваш главный корабль отправляется домой 
1623,something that made you very sad  nothing made me sad i am just slacking ,prob_B,algo que te hizo muy triste nada me entristeció sólo estoy floja ,qualcosa che ti ha reso molto triste niente mi ha reso triste sto solo rilassando ,"etwas, das dich sehr traurig gemacht nichts machte mich traurig ich bin nur nachlassen ",iets wat jou baie hartseer niks gemaak het my hartseer ek is net traag ,"Что-то, что сделало тебя очень грустным, ничто не заставило меня грустить, я просто слабак. "
1624,i don t want to mention names  well it s up to you ,prob_B,"No quiero mencionar nombres, bueno, depende de ti. ",Non voglio menzionare i nomi bene è fino a voi ,"Ich will keine Namen erwähnen, aber es liegt an dir. ",I don t wil hê na meld name goed dit s begin na jy ,"Я не хочу упоминать имена, это зависит от тебя. "
1625,danny seldom does a day go by that i m not burned in effigy  hello,prob_B,Danny rara vez pasa un día que no estoy quemado en efigie hola,Danny raramente fa un giorno passare che io m non bruciato in effigy ciao,"Danny selten einen Tag vergehen, dass ich nicht verbrannt in effigy hallo",danny doen selde 'n dag gaan deur wat ek m nie verbrand in Defigy hallo,"Дэнни редко ходит день, когда я не горю в эффи-привет."
1626,hi how are you  i m fine you ,prob_B,"Hola, ¿cómo estás? Estoy bien. ","Ciao, come stai? ","Hallo, wie geht's dir? ",hi hoe is jy i m fyn jy ,"Привет, как у тебя дела? "
1627,i m also doing well i just got home from a trip to norway  how was your trip,prob_B,También lo estoy haciendo bien Acabo de llegar a casa de un viaje a Noruega ¿Cómo fue tu viaje,Sto anche facendo bene sono appena tornato a casa da un viaggio a Norway com'è stato il tuo viaggio,"Ich mache auch gut ich kam gerade nach Hause von einer Reise nach Norway, wie war Ihre Reise",Ek m ook goed doen ek net by die huis gekom het van 'n reis na of pad hoe was jou reis,"Я так же хорошо справляюсь. Я только что вернулся из поездки в Норвей, как прошла твоя поездка."
1628,good would been better with someone with me what do you do for fun  i like riding horses,prob_B,bueno sería mejor con alguien conmigo lo que haces por diversión me gusta montar a caballo,bene sarebbe stato meglio con qualcuno con me che cosa fai per divertimento mi piace equitazione cavalli,"gut wäre besser mit jemand bei mir, was tun Sie für Spaß Ich mag Reiten Pferde",goed sou beter met iemand saam met my wat doen jy vir die pret ek hou van ry perde,"Хорошо было бы лучше, если бы кто-то со мной что ты делаешь для веселья Я люблю ездить на лошадях"
1629,horses are cool but i ask more into fantasy animals like dragons what are you up to today  i m going to meet a girl tonight wish me luck ,prob_B,Los caballos son geniales pero pido más en animales de fantasía como dragones lo que estás haciendo hoy voy a conocer a una chica esta noche deséame suerte ,I cavalli sono cool ma chiedo di più in animali fantasy come draghi che cosa stai fino a oggi ho intenzione di incontrare una ragazza stasera augurarmi buona fortuna ,"Pferde sind cool, aber ich frage mehr in Fantasy-Tiere wie Drachen, was bist du bis heute ich werde ein Mädchen heute Abend zu treffen wünschen mir Glück ","perde is cool, maar ek vra meer in fantasie diere soos drake wat jy vandag gaan ontmoet 'n meisie vanaand wens my geluk ","Лошади - это круто, но я спрашиваю больше о воображаемых животных, таких как драконы, что ты задумал сегодня, я собираюсь встретиться с девушкой сегодня вечером, пожелай мне удачи. "
1630,i cant my husband and kids drive me to drink also try to guess my cats are  beautiful ,prob_B,No puedo mi marido y mis hijos me llevan a beber también tratar de adivinar que mis gatos son hermosos ,I cant mio marito e bambini mi portano a bere anche cercare di indovinare i miei gatti sono bellissimi ,"Ich kann meinen Mann und Kinder fahren mich zu trinken auch versuchen, meine Katzen sind schön zu raten ",Ek kan my man en kinders dryf my ook om te drink probeer raai my katte is mooi ,"Я не могу отвезти моего мужа и детей выпить, а также попытаться догадаться, что мои кошки красивы. "
1631,very special to me funny you  what do you do for a living,prob_B,muy especial para mí divertido lo que haces para ganarse la vida,molto speciale per me divertente tu cosa fai per vivere,sehr speziell für mich lustig Sie was tun Sie für einen Lebensunterhalt,Baie spesiaal vir my snaaks jy wat doen jy vir 'n bestaan,"Забавно, что ты зарабатываешь на жизнь."
1632,i work in an office building it has also paid well and supports my love of cars what are you up to  i am going to be a lawyer soon ,prob_B,Trabajo en un edificio de oficinas que también ha pagado bien y apoya mi amor por los coches lo que están hasta que voy a ser un abogado pronto ,lavoro in un edificio di ufficio ha anche pagato bene e sostiene il mio amore per le auto che cosa stai fino a io sto per essere un avvocato presto ,"Ich arbeite in einem Bürogebäude es hat auch gut bezahlt und unterstützt meine Liebe zu Autos, was sind Sie bis ich werde ein Anwalt bald sein ",Ek werk in 'n kantoorgebou wat dit ook goed betaal het en ondersteun my liefde vir motors wat jy is na ek gaan binnekort 'n prokureur wees ,"Я работаю в офисном здании, которое также хорошо заплатило и поддерживает мою любовь к машинам то, что ты задумал, я скоро стану адвокатом. "
1633,oh thank you i would love to marry a lawyer also try to guess my dad taught  you how to ride a bike ,prob_B,Oh gracias me encantaría casarme con un abogado también tratar de adivinar mi papá te enseñó a montar en bicicleta ,Oh grazie mi piacerebbe sposare un avvocato anche cercare di indovinare mio padre ti ha insegnato come andare in bicicletta ,"oh danke ich würde gerne einen Anwalt heiraten auch versuchen, zu erraten, mein Vater lehrte Sie, wie man Fahrrad fahren ","O, dankie dat ek graag met 'n prokureur wou trou, probeer ook om my pa te raai hoe om 'n fiets te ry ","О, спасибо, я бы с удовольствием женился на юристе и попытался бы угадать, что мой отец научил тебя кататься на велосипеде. "
1634,me everything i know funny you  what do you do for fun,prob_B,yo todo lo que sé divertido lo que haces por diversión,io tutto quello che so divertente tu cosa fai per divertimento,ich alles was ich weiß lustig du was machst du zum Spaß,Ek weet alles snaaks jy wat doen jy vir die pret,"Я знаю все, что забавно, что ты делаешь для веселья."
1635,i play with my parrot that i love his name is todd  good to see you ,prob_B,Yo juego con mi loro que me encanta su nombre es Todd bueno verte ,Gioco con il mio pappagallo che amo il suo nome è Todd bello vederti ,"Ich spiele mit meinem Papagei, dass ich liebe seinen Namen ist totd gut, dich zu sehen ",Ek speel met my papegaai dat ek lief is vir sy naam is om goed te voeg om jou te sien ,"Я играю со своим попугаем, что люблю его имя. Тодд рад тебя видеть. "
1636,thanks how are you  i am good just got back from the gym ,prob_NB,Gracias. ¿Cómo estás? Estoy bien. Acabo de volver del gimnasio. ,Grazie come sei che sono bravo appena tornato dalla palestra ,"Danke, wie bist du ich gut bin gerade aus dem Fitness-Studio zurück ",dankie hoe is jy ek is goed net terug van die gimnasium ,"Спасибо, как ты себя чувствуешь, что я только что вернулся из спортзала. "
1637,which sports do you like  i do i like to play sports ,prob_NB,¿Qué deportes te gustan? Me gusta practicar deportes. ,quale sport ti piace che mi piace giocare a sport ,"welche Sportarten mögen Sie, ich mag es, Sport zu spielen ",wat sport doen jy hou van i wil hê na speel sport ,"В каком спорте ты любишь, я люблю заниматься спортом. "
1638,i like to go to casino and go to casino are you a gambler ,prob_B,Me gusta ir al casino e ir al casino eres un jugador ,Mi piace andare al casinò e andare al casinò sei un giocatore d'azzardo ,Ich gehe gerne ins Casino und gehe ins Casino sind Sie ein Spieler ,"Ek hou daarvan om casino toe te gaan en na casino te gaan, is jy 'n dobbelaar ",Я люблю ходить в казино и ходить в казино. Ты игрок. 
1639,gambling is bad highly likely ,prob_NB,Es muy probable que el juego sea malo ,gioco d'azzardo è brutto molto probabile ,Glücksspiel ist sehr wahrscheinlich ,Dobbelary is hoogs waarskynlik sleg ,"Очень вероятно, что азартные игры "
1640,are you single are you married  no i am not married i was just a kid ,prob_NB,"¿Estás soltera? ¿Estás casada? No, no estoy casada. Sólo era un niño. ",Sei single sei sposato no non sono sposato ero solo un bambino ,Sind Sie alleinstehend sind Sie verheiratet Nein Ich bin nicht verheiratet Ich war nur ein Kind ,is jy ongetroud is jy getroud nee ek is nie getroud i was net 'n kind ,"Ты одинока, ты замужем. Я не замужем. Я был еще ребенком. "
1641,are you male do you like watching tv what is your favorite tv program  i think that answer is grill outdoors,prob_B,¿Eres macho te gusta ver la televisión lo que es su programa favorito de televisión creo que la respuesta es parrilla al aire libre,Sei maschio fare ti piace guardare la tv qual è il tuo programma preferito tv penso che la risposta è grill all'aperto,"sind Sie männlich tun Sie wie Fernsehen, was ist Ihre Lieblings-TV-Programm ich denke, dass Antwort ist Grill im Freien",is jy man doen jy hou van kyk na tv wat is jou gunsteling tv program Ek dink dat antwoord rooster buite is,"Вы мужчина, вам нравится смотреть ТВ, что ваша любимая телепрограмма, я думаю, что ответ - это гриль на открытом воздухе"
1642,i like to eat a lot of meat  do you like swimming ,prob_B,Me gusta comer mucha carne. ¿Te gusta nadar? ,Mi piace mangiare un sacco di carne ti piace nuotare ,ich mag zu essen viel Fleisch tun Sie gerne schwimmen ,Ek hou daarvan om baie vleis te eet as jy wil swem ,"Я люблю есть много мяса, а ты любишь плавать. "
1643,i do not but i love to eat it that s cool i swim in the ocean ,prob_B,"No lo hago, pero me encanta comerlo que s cool nado en el océano ",Non lo faccio ma mi piace mangiarlo che è fresco nuoto nell'oceano ,"Ich nicht, aber ich liebe es zu essen, dass kühl ich im Ozean schwimmen ","Ek doen nie, maar ek hou daarvan om dit te eet wat s koel ek swem in die see ","Нет, но я люблю есть, что круто, что я плаваю в океане. "
1644,do you like to swim  i do not like to swim,prob_NB,¿Te gusta nadar? No me gusta nadar.,ti piace nuotare non mi piace nuotare,schwimmst du gerne ich schwimme nicht gerne,"doen jy hou van swem, ek hou nie van swem nie",Ты любишь плавать Я не люблю плавать
1645,okay but do you like water  i do not like to swim,prob_B,"Está bien, ¿pero te gusta el agua? No me gusta nadar.","Ok, ma ti piace l'acqua che non mi piace nuotare?","Okay, aber mögen Sie Wasser ich nicht gerne schwimmen","Goed, maar doen jy hou van water Ek hou nie van swem nie","Ладно, но ты любишь воду, я не люблю плавать."
1646,got it what do you like then  i like to go to the park and see the best,prob_NB,Lo tengo lo que te gusta entonces me gusta ir al parque y ver el mejor,ho avuto quello che ti piace poi mi piace andare al parco e vedere il meglio,"Ich habe es bekommen, was du magst, dann gehe ich gerne in den Park und sehe das Beste",Het dit wat doen jy hou dan ek hou van om te gaan na die park en sien die beste,"Получил то, что тебе понравилось, и я люблю ходить в парк и смотреть на лучшее."
1647,i see do you like the natute  i do not like to watch much tv i like to watch the movies ,prob_B,¿Te gusta el natute? No me gusta ver mucha televisión. Me gusta ver las películas. ,Vedo che ti piace il natute non mi piace guardare molto tv mi piace guardare i film ,"ich sehe, Sie mögen die natute ich mag nicht zu sehen viel tv ich mag, um die Filme zu sehen ",Ek sien doen jy hou van die natute ek hou nie van na kyk baie tv i hou van na die rolprente ,"Я вижу, ты любишь натут, я не люблю смотреть телевизор, я люблю смотреть фильмы. "
1648,what is your favorite type of movie  i like action movies movies movies movies movies movies movies,prob_B,¿Cuál es tu tipo favorito de película me gusta las películas de acción películas películas películas películas películas,Qual è il tuo tipo preferito di film mi piace film d'azione film film film film film film film film film film,was ist Ihre Lieblings-Art von Film Ich mag Action-Filme Filme Filme Filme Filme Filme,Wat is jou gunsteling soort rolprent ek hou van rolprente in rolprente rolprente,Какой твой любимый тип фильма я люблю кинофильмы кинофильмов
1649,action movie i see don t you like drama  i like to watch movies i love movies,prob_NB,película de acción que veo no te gusta el drama me gusta ver películas me encantan las películas,azione film vedo don t ti piace dramma mi piace guardare i film mi piace film,Action-Film sehe ich Don t you mag Drama ich mag Filme zu sehen ich liebe Filme,aksie rolprent Ek sien Don t jy hou van drama Ek hou van na rolprente kyk Ek hou van rolprente,"Фильм, который я вижу, тебе не нравится драма, я люблю смотреть фильмы, я люблю фильмы."
1650,got it what about books  i read books about books i love it ,prob_NB,"Lo tengo, ¿qué hay de los libros que leo libros sobre libros que me encanta? ",ho letto libri sui libri che mi piace ,"Was ist mit Büchern, die ich über Bücher lese, die ich liebe? ",het dit gekry wat van boeke wat ek lees boeke oor boeke Ek hou daarvan ,"Как насчет книг, которые я читаю о книгах, которые мне нравятся. "
1651,sounds nice is that how to write a book  i write books about it i write it is writing it ,prob_B,Suena bien es que cómo escribir un libro Escribo libros sobre él Escribo es escribirlo ,suoni bello è che come scrivere un libro scrivo libri su di esso lo scrivo sta scrivendo ,"klingt schön ist, dass wie man ein Buch schreibt ich Bücher darüber schreibe ich schreibe es schreibt es ","klink goed, is dat hoe om 'n boek te skryf Ek skryf boeke oor dit ek skryf dit is skryf dit ","Звучит неплохо, так это то, что как написать книгу, которую я пишу об этом, я пишу ее. "
1652,so you are a writer  i write mostly poetry and poetry,prob_NB,Así que eres un escritor. Escribo sobre todo poesía y poesía.,Quindi tu sei uno scrittore che scrivo per lo più poesia e poesia,also bist du ein Schriftsteller ich schreibe meist Poesie und Poesie,so jy is 'n skrywer Ek skryf meestal gedigte en gedigte,"Так ты писатель, я пишу в основном поэзию и поэзию."
1653,good do you like your job  i do i like to work at the local theater,prob_NB,bueno te gusta tu trabajo me gusta trabajar en el teatro local,Ti piace il tuo lavoro? Mi piace lavorare al teatro locale.,"gut mögen Sie Ihren Job ich tue ich mag, um im lokalen Theater zu arbeiten","goed doen jy hou van jou werk, ek hou van om te werk by die plaaslike teater",Я люблю работать в местном театре.
1654,hi i am doing great how are you  fine thnx and you ,prob_B,"Hola, lo estoy haciendo muy bien. ¿Cómo estás tú y tú? ",Ciao sto facendo grande come stai bene Thnx e tu ,"hi ich bin tun toll, wie sind Sie fein thnx und Sie ",hi i doen groot hoe is jy fyn thnx en jy ,"Привет, я отлично справляюсь. Как ты справляешься? "
1655,i m doing great just got back from a long walk with my of zit ah with what sorry ,prob_B,Lo estoy haciendo muy bien. Acabo de volver de un largo paseo con mi zit ah con lo que siento. ,Sto andando alla grande appena tornato da una lunga passeggiata con la mia di zit ah con quello che mi dispiace ,Ich bin tun super nur zurück von einem langen Spaziergang mit meinem von zit ah mit was leid ,I m doen great net terug van 'n lang stap met my van zoit ah met wat jammer ,"Я отлично справляюсь, только что вернулся с долгой прогулки с моими прыщами с тем, что мне жаль. "
1656,i just got back from a long day of work okey where are you working at ,prob_B,Acabo de volver de un largo día de trabajo okey donde estás trabajando en ,Sono appena tornato da una lunga giornata di lavoro ok dove stai lavorando ,Ich kam gerade von einem langen Tag der Arbeit okey wo du arbeitest bei ,Ek het net terug van 'n lang dag van werk okey waar werk jy aan ,"Я только что вернулся с долгого рабочего дня, где ты работаешь. "
1657,i am a manager at a local station what s the station you are working at ,prob_B,Soy gerente en una estación local en la que estás trabajando. ,Sono un manager di una stazione locale che è la stazione in cui si sta lavorando ,"Ich bin Manager an einem lokalen Bahnhof, bei dem Sie arbeiten. ",Ek is 'n bestuurder by 'n plaaslike stasie watter s die stasie jy werk by ,"Я менеджер местной станции, на которой ты работаешь. "
1658,no i do not work at the local station then who you are ,prob_B,"No, no trabajo en la estación local. Entonces, ¿quién eres? ",no io non lavoro alla stazione locale allora chi sei ,"Nein, ich arbeite nicht am örtlichen Bahnhof, dann wer du bist. ",geen ek werk nie by die plaaslike stasie dan wie jy is ,"Нет, я не работаю на местной станции, тогда кто ты такой. "
1659,i like elvis he is an elvis fan smiling face with open mouth how old are you ,prob_B,Me gusta Elvis es un fan de Elvis sonriente cara con la boca abierta ¿Qué edad tienes ,"Mi piace Elvis, è un fan di Elvis che sorride con la bocca aperta. Quanti anni hai? ",ich mag elvis er ist ein elvis fan lächelnd gesicht mit offenem mund wie alt bist du ,Ek hou van elvis hy is 'n elvis waaier glimlag gesig met oop mond hoe oud is jy ,"Мне нравится Элвис, он фанат Элвиса, улыбающийся с открытым ртом, сколько тебе лет. "
1660,and where are you from  i m from the usa how about you ,prob_NB,"¿Y de dónde eres tú, de los EE.UU.? ¿Qué hay de ti? ",E tu da dove vieni dagli Stati Uniti che ne dici di te? ,und wo sind Sie von i m von der usa wie über Sie ,en waar is jy van i m van die wea hoe oor jou ,И откуда ты из-за меня? Как насчет тебя? 
1661,i love to be alone winking face hi there how are you ,prob_B,Me encanta estar sola guiñando cara hola allí cómo estás ,Mi piace stare da solo ammiccando face hi there come sei ,"Ich liebe es, allein zu sein zwinkern Gesicht Hallo da, wie bist du ",Ek is lief om alleen knip gesig hi daar hoe is jy ,"Я люблю быть одинокой, подмигивая. Привет, как дела? "
1662,i love purple you know its royal grinning face with smiling eyes i think i like red whera are you working ,prob_B,Me encanta el morado. Conoces su cara real sonriente con ojos sonrientes. Creo que me gusta el rojo. ¿Qué estás haciendo? ,Io amo il viola sai che la sua faccia reale sorridente con gli occhi sorridenti penso che mi piace rosso whera stai lavorando ,"ich liebe lila Sie wissen, seine königlich grinst Gesicht mit lächelnden Augen ich denke, ich wie rot whera sind Sie arbeiten ","Ek is lief vir pers jy ken sy koninklike glimlag gesig met glimlaggende oë, ek dink ek is soos rooi whera werk jy ",Я люблю фиолетовый ты знаешь его королевское улыбающееся лицо с улыбающимися глазами я думаю я люблю красную веру ты работаешь 
1663,not pets i d probably eat them up  funny you i would rather eat cheeseburgers actually they my favourite,prob_B,"No las mascotas, probablemente me las comería divertidas. Preferiría comer hamburguesas con queso. En realidad, son mis favoritas.",Non gli animali domestici i d probabilmente li mangiano divertente voi preferirei mangiare cheeseburger in realtà sono i miei preferiti,nicht Haustiere i d wahrscheinlich essen sie bis lustig Sie würde ich lieber Cheeseburger essen eigentlich sie meine Lieblings,"nie troeteldiere Ek d eet hulle waarskynlik snaaks, jy sal liewer kaasburgers eet hulle my gunsteling","а не питомцев, которых я, наверное, съел бы забавно ты я бы предпочел съесть чизбургеры на самом деле они мои любимые"
1664,i like to talk a lot  i also i have many social skills since i was a gym teacher back in the day,prob_B,Me gusta hablar mucho También tengo muchas habilidades sociales desde que era profesor de gimnasia en el día,Mi piace parlare molto ho anche molte abilità sociali da quando ero un insegnante di ginnastica indietro nel giorno,"ich mag viel zu sprechen ich habe auch viele soziale Fähigkeiten, da ich ein Gymnastiklehrer war zurück in den Tag",Ek hou van om te praat baie ek ook ek het baie sosiale vaardighede sedert ek was 'n gimnasium onderwyser terug in die dag,"Я люблю много говорить, у меня тоже много социальных навыков с тех пор, как я был учителем в тренажерном зале."
1665,bummer i like to stay active by horseback riding and snowboarding also try to guess i work my  not sure i will guess,prob_B,me gusta estar activo montando a caballo y snowboard también tratar de adivinar que trabajo mi no estoy seguro de que voy a adivinar,bummer mi piace rimanere attivo da equitazione e snowboard cercare anche di indovinare lavoro il mio non sicuro che indovinerò,"bummer ich mag zu bleiben aktiv von reiten und snowboarding auch versuchen, zu raten, ich arbeite meine nicht sicher, ich werde raten",eummer i hou van om aktief te bly deur te perd ry en sneeuplanke ook probeer raai ek werk my nie seker ek sal raai,"Обидно, что мне нравится оставаться активными в лошадиной катании и сноубординге, а также пытаться догадаться, что я работаю не уверена, что угадаю."
