,utterance,label,translation_es,translation_it,translation_de,translation_af,translation_ru
0,i am little bit shywhite smiling face tell me about yourself  allright i have a german shepher dog his name is clue i love animals beside dogs do you love animals too ,prob_B,Soy un poco tímido blanco sonriente cara cuéntame de ti mismo todo bien tengo un perro alemán Shepher su nombre es pista me encantan los animales al lado de los perros te gustan los animales también ,Sono un po' timido viso sorridente dimmi di te tutto bene ho un pastore tedesco cane il suo nome è indizio amo gli animali accanto ai cani non ami gli animali troppo ,Ich bin ein bisschen schüchternweiß lächelndes Gesicht erzählen Sie mir von sich selbst in Ordnung Ich habe einen deutschen Shepher Hund sein Name ist Hinweis Ich liebe Tiere neben Hunden lieben Sie Tiere auch ,Ek is min skaam wit glimlag gesig vertel my van jouself alright ek het 'n kiemaar hifer hond sy naam is leidraad ek lief diere langs honde ook jy lief diere ,"Я немного застенчиво улыбаюсь, улыбаясь, расскажи мне о себе. Хорошо, у меня есть немецкая сефер-собачка. Его имя - подсказка, что я люблю животных рядом с собаками. Ты тоже любишь животных. "
1,i do i have a dog named patrick he is a bichon do you enjoy building houses  well i do but most of that i like coloring books,prob_B,Tengo un perro llamado Patrick que es un bichon te gusta construir casas así que lo hago pero la mayoría de eso me gustan los libros para colorear,"Io ho un cane di nome Patrick lui è un bichon ti piace costruire case bene lo faccio, ma la maggior parte di quello mi piace i libri da colorare","ich habe ich einen Hund namens patrick er ist ein bichon tun Sie gerne Gebäude Häuser gut ich tun, aber die meisten, die ich mag Färbung Bücher","Ek het 'n hond met die naam patrick hy is' n bichon doen jy geniet bou huise goed ek doen, maar die meeste van wat ek hou van kleur boeke","У меня есть собака по имени Патрик. Он - бичон. Тебе нравится строить дома, но больше всего я люблю раскрашивать книги."
2,i like to collect things but i am not a big fan of them are you a construction worker  i am not are you a construction worker ,prob_B,Me gusta coleccionar cosas pero no soy un gran fan de ellas eres un trabajador de la construcción no soy un trabajador de la construcción ,"Mi piace raccogliere le cose, ma non sono un grande fan di loro sei un lavoratore edile io non sono un lavoratore edile ","Ich mag Dinge sammeln, aber ich bin nicht ein großer Fan von ihnen sind Sie ein Bauarbeiter ich bin nicht Sie ein Bauarbeiter ","Ek hou van om dinge te versamel, maar ek is nie 'n groot fan van hulle is jy' n konstruksiewerker Ek is nie 'n konstruksie-werker nie ","Я люблю собирать вещи, но я их не большой фанат. Вы строительный работник. Я не строительный работник. "
3,i am a expression worker i am axerophthol expression worker  what is axerophthol,prob_B,Soy un trabajador de la expresión soy axerophthol trabajador de la expresión lo que es axerophthol,Sono un lavoratore di espressione sono lavoratore di espressione di axerophthol che cosa è axerophthol,ich bin ein expression worker ich bin axerophthol expression worker was ist axerophthol,Ek is 'n uitdrukking werker Ek is' n xeroftool uitdrukking werker wat asxerofthol is,"Я экспресс-работник, я аксерофтол-рабочий, что есть аксерофтол."
4,i love to make friends and family have you  i don t have any cats i just have a dog but i like cats so much ,prob_B,Me encanta hacer amigos y familia te tengo yo no tengo gatos yo sólo tengo un perro pero me gustan tanto los gatos ,"Mi piace fare amici e familiari hanno voi non ho tutti i gatti ho solo un cane, ma mi piacciono i gatti così tanto ","Ich liebe es, Freunde und Familie haben Sie Ich habe keine Katzen Ich habe nur einen Hund, aber ich mag Katzen so sehr ","Ek hou baie daarvan om vriende te maak en familie het jy jy ek het t het enige katte Ek het net 'n hond, maar ek hou van katte so baie ","Я люблю заводить друзей и семью. У меня нет кошек, у меня только собака, но я так люблю кошек. "
5,i have a cat named oreo he is my favorite  it s a great name tell me about you more,prob_B,Tengo un gato llamado Oreo. Es mi favorito. Es un gran nombre.,Ho un gatto di nome Oreo è il mio preferito è un grande nome mi dica di più,ich habe eine Katze namens oreo er ist mein Favorit es ist ein toller Name erzählen Sie mir mehr,Ek het 'n kat genaamd oreo hy is my gunsteling dit s'n groot naam vertel my van jou meer,"У меня есть кот по имени Орео, он мой любимый. Это прекрасное имя, расскажи мне о тебе больше."
6,i have never seen that i am sure it is  tell me about yourself one kiss is all it takes don t you ever forget that ,prob_B,Nunca he visto que estoy seguro de que es hablar de ti mismo un beso es todo lo que se necesita no olvides nunca que ,Non ho mai visto che sono sicuro che è dirmi di te stesso un bacio è tutto ciò che ci vuole Don non si dimentica mai che ,"Ich habe noch nie gesehen, dass ich sicher bin, es ist mir über sich selbst zu erzählen ein Kuss ist alles, was es braucht, nicht Sie jemals vergessen, dass ",Ek het nog nooit gesien dat ek seker is dit vertel my van jouself een soen is al wat dit neem doen t jy ooit vergeet dat ,"Я никогда не видела, что я уверена, что это говорит мне о себе один поцелуй это все, что нужно не забывай никогда "
7,i do not think that is a good thing  i never said it s a good thing you just make sure you remember ,prob_B,No creo que sea algo bueno. Nunca dije que fuera algo bueno. Sólo asegúrate de recordar. ,Non penso che sia una buona cosa che non ho mai detto è una buona cosa basta assicurarsi che ti ricordi ,"Ich glaube nicht, dass das eine gute Sache ist, die ich nie gesagt habe, es ist eine gute Sache, die Sie nur sicherstellen, dass Sie sich erinnern ",Ek dink nie dat dit 'n goeie ding is wat ek nooit gesê het dit 'n goeie ding jy net seker maak jy onthou. ,"Я не думаю, что это хорошо, что я никогда не говорила, что это хорошо, что ты просто должен быть уверен, что ты помнишь "
8,i think i will try that i am not sure if i could fit right in  what do you like to do,prob_B,Creo que voy a intentar que no estoy seguro de si podría encajar bien en lo que te gusta hacer,Penso che proverò che non sono sicuro se potrei adattarsi a destra in che cosa ti piace fare,"Ich denke, ich werde versuchen, dass ich nicht sicher bin, ob ich richtig passen könnte in, was Sie gerne tun",Ek dink ek sal probeer dat ek nie seker is of ek reg kan pas in wat doen jy hou van om te doen,"Думаю, я постараюсь, что я не уверена, смогу ли я вписаться в то, что ты любишь делать."
9,i like to surf and surf where do you surf often,prob_B,Me gusta surfear y surfear donde surfeas a menudo,mi piace fare surf e surf dove fai surf spesso,ich surfe und surfe gerne wo surfst du oft,Ek hou van om te blaai en blaai waar gaan jy dikwels deur,"Я люблю сёрфить и сёрфить, где ты часто серфингируешь."
10,i am a pilot by the way hello danny,prob_B,"Soy piloto, por cierto, hola Danny.",Sono un pilota a proposito ciao Danny,Ich bin übrigens ein Pilot Hallo Danny,Ek is 'n vlieënier deur die manier waarop hallo dany,"Я пилот, кстати, Дэнни."
11,hi there i ll kill him ,prob_B,"Hola, lo mataré. ","Ciao, lo uccido. ","Hallo, ich werde ihn töten. ",hi daar sal ek hom doodmaak ,"Привет, я убью его. "
12,no please do not do that ma you take your medication ,prob_B,"No, por favor, no hagas eso, mamá, toma tu medicación. ",no si prega di non fare che ma si prende il farmaco ,"Nein bitte tun Sie nicht, dass ma Sie Ihre Medikamente nehmen ",nee asseblief nie doen dat ma jy jou medikasie neem nie ,"Нет, пожалуйста, не делай маму ты принимаешь свои лекарства "
13,i am not your mom i am not ,prob_B,No soy tu madre. No lo soy. ,"Non sono tua madre, non sono... ",ich bin nicht deine mutter ich bin nicht ,Ek is nie jou ma ek is nie ,"Я не твоя мама, я не твоя мама. "
14,of course you are not yeah bu bu but why ,prob_B,De course you are not siah this but why ,,,,
15,because you are just my friend  well yeah okay ,prob_NB,"porque sólo eres mi amigo, bueno, sí, bien. ","Perche' sei solo un mio amico, si' ok. ",weil du nur mein Freund bist ja okay ,want jy is net my vriend goed ja okay ,"Потому что ты просто мой друг, хорошо? "
16,how many friends do you have  how many what ,prob_B,¿Cuántos amigos tienes? ¿Cuántos qué? ,Quanti amici hai? Quanti amici hai? ,wie viele Freunde hast du wie viele was? ,hoeveel vriende jy het hoeveel wat jy het ,Сколько у тебя друзей? 
17,friends friends ,prob_B,friends friends ,friends friends ,Friends friends ,frigends friends ,friends friends 
18,yes how many  you watch there s going to be a hymen holocaust tomorrow ,prob_B,"Sí, ¿cuántos ves que va a haber un holocausto de himen mañana? ","Si', quante ne guarderai domani ci sara' un olocausto imeno. ","Ja, wie viele du da siehst, wird morgen ein Hymen-Holocaust sein ","Ja, hoeveel jy daar kyk, sal môre 'n hemen - slagting wees ","Да, сколько ты будешь смотреть, завтра будет холокауст-гимен. "
19,what  your mother hey we been talkin about you ,prob_B,lo que tu madre hey hemos estado hablando de ti ,quello che tua madre hey abbiamo parlato di te ,was deine mutter hey wir gesprochen haben über dich ,wat jou ma hey ons praat oor jou ,"Что твоя мать, эй, мы говорили о тебе "
20,i think you are confused sit over here ,prob_B,Creo que estás confundido. Siéntate aquí. ,"Penso che tu sia confuso, siediti qui. ","Ich glaube, du bist verwirrt, sitzt hier drüben. ",Ek dink jy is verward sit hier ,"По-моему, вы запутались, сидите здесь. "
21,i am little bit shywhite smiling face tell me about yourself  finally don t be shy i m blond,prob_B,Soy un poco tímido blanco sonriente cara cuéntame de ti finalmente no seas tímido soy rubio,Sono un po 'timido volto sorridente mi dicono di te finalmente non essere timido i m biondo,ich bin wenig schüchternweiß lächelndes Gesicht erzählen mir über sich selbst endlich nicht schüchtern sein i m blond,"Ek is min skaam, wit glimlag gesig vertel my van jouself uiteindelik t skaam i m blond","Я немного застенчиво улыбаюсь, расскажи мне о себе, наконец-то, не стесняйся, я блондинка."
22,i only have one but i want to be a music teacher do you listen to rap music  i have to because i m working at bar,prob_B,Sólo tengo una pero quiero ser profesora de música. Escuchas música rap. Tengo que hacerlo porque trabajo en el bar.,Ho solo uno ma voglio essere un insegnante di musica non si ascolta musica rap devo perché io lavoro al bar,"Ich habe nur eine, aber ich möchte ein Musiklehrer sein, hörst du Rap-Musik, die ich muss, weil ich in der Bar arbeite","Ek het net een maar ek wil 'n musiek onderwyser wees, luister jy na rap-musiek Ek het om te want ek werk by bar","У меня только один, но я хочу быть учителем музыки. Ты слушаешь рэп-музыку, которую я должен слушать, потому что я работаю в баре."
23,i have a lot of piercings that i drive around  okay do you have tattoos ,prob_B,"Tengo un montón de piercings por los que conduzco bien, ¿tienes tatuajes? ",Ho un sacco di piercing che guido in giro ok hai tatuaggi ,"Ich habe eine Menge Piercings, die ich fahren um okay haben Sie Tattoos ",Ek het baie deursteekte wat ek ry rondom okay het jy tatoeëermerke ,"У меня много пирсингов, что я еду вокруг хорошо у тебя есть татуировки "
24,no tattoos i have a honda civic do you produce music for artists  no i wish i was but i just working at bar,prob_B,No hay tatuajes tengo una honda cívica ¿produces música para artistas no me gustaría estar pero yo sólo trabajando en el bar,"nessun tatuaggio ho un honda civic fai produrre musica per gli artisti no vorrei essere, ma io solo lavoro al bar","keine Tätowierungen ich habe eine honda staatsbürgerliche tun Sie produzieren Musik für Künstler nein ich wünschte, ich war, aber ich arbeitete nur in der Bar",geen tatoeëermerke Ek het 'n cenda burger doen jy maak musiek vir kunstenaars nee ek wens ek was maar ek net werk by die kroeg,Нет татуировок у меня есть хонда цивилизованный ты продюсер музыки для художников нет я бы хотел быть но я просто работаю в баре
25,i drive a ton of my carautomobile  nice for you which car do you have ,prob_B,Conduzco una tonelada de mi coche automóvil agradable para ti qué coche tienes ,Guido una tonnellata della mia roulotte bella per voi quale auto avete ,"Ich fahre eine Tonne von meinem Autoautomobil schön für Sie, welches Auto haben Sie ",Ek ry 'n ton van my karomobiel goed vir jou watter motor het jy ,"Я езжу на куче моего караутомобиля, хорошо для тебя, какая у тебя машина. "
26,i drive a ford civic it is a ford focus  good car i don t have enoygh money for this ,prob_B,Conduzco un vado cívico es un Ford foco buen coche no tengo dinero enoygh para esto ,io guido un guado civico è un guado fuoco buona auto non ho soldi enoygh per questo ,Ich fahre eine Ford Bürger ist es eine Ford Fokus gut Auto ich habe nicht Enoygh Geld für diese ,Ek bestuur 'n ford burger dit is' n fokus goeie kar Ek het nie enygh geld vir hierdie ,"Я езжу на буддистской гражданской, это буддистская хорошая машина, у меня нет денег на это. "
27,i have no idea what that is i am more of a carautomobile person  sorry good car i don t have enough money for this ,prob_B,No tengo ni idea de lo que es que soy más de una persona automóvil coche lo siento buen coche no tengo suficiente dinero para esto ,Non ho idea di cosa questo sia io sono più di una persona carautomobile dispiaciuto buona auto non ho abbastanza soldi per questo ,"Ich habe keine Ahnung, was das ist, bin ich mehr von einem Autoautomobil Person sorry good Auto ich habe nicht genug Geld für diese ",Ek het geen idee wat dit is ek is meer van 'n karomobiel persoon jammer goeie kar ek doen t het genoeg geld vir hierdie ,"Я понятия не имею, что это такое, больше как караутомобильный человек, извини за хорошую машину, у меня недостаточно денег для этого. "
28,i am not that good at all  you are good person,prob_B,No soy tan bueno para nada. Eres una buena persona.,Non sono cosi' brava che tu sia una brava persona.,"Ich bin gar nicht so gut, dass du ein guter Mensch bist",Ek is nie so goed op al wat jy is goeie persoon,"Я не настолько хороша, что ты хороший человек."
29,i am i am a pizza person  i am not chicken person,prob_B,Soy una persona de pizza. No soy una persona de pollo.,Io sono una persona pizza non sono persona pollo,ich bin ich bin eine Pizza Person ich bin nicht Huhn Person,i am i am a pizza persooni is nie hoender persoon,"Я пицца, я не куриный человек."
30,i am a very good person i am not a fan of meat though  are you a vegan ,prob_B,Soy una muy buena persona no soy un fan de la carne aunque eres un vegano ,Sono una persona molto buona non sono un fan della carne anche se sei un vegano ,"Ich bin ein sehr guter Mensch, ich bin kein Fan von Fleisch, obwohl du ein Veganer bist ",Ek is 'n baie goeie mens Ek is nie' n fan van vleis al is jy 'n vgan ,"Я очень хороший человек, я не фанат мяса, хотя ты веган. "
31,i am not a vegan i am vegan  hey waving hand sign how is your day thinking face,prob_B,no soy vegano soy vegano hey agitando la mano signo cómo es su día pensando cara,Io non sono un vegano sono vegano hey sventolando segno mano come è la vostra giornata pensando faccia,ich bin nicht ein vegan ich bin vegan hey winken Handzeichen wie ist Ihr Tag denkendes Gesicht,Ek is nie 'n vgan i is vgan hean wling hand teken hoe is jou dag denke gesig,"Я не веган, я веган, эй, размахиваю рукой, как твой день мыслит лицо"
32,hello i m tired hi i am good how are you ,prob_NB,"Hola, estoy cansado, hola, soy bueno, ¿cómo estás? ",Ciao io sono stanco ciao io sono buono come sei ,"Hallo ich bin müde hi ich bin gut, wie Sie ",hallo i m moeg hii is goed hoe is jy ,"Привет, я устала. Привет. Как дела? "
33,not good who are you  i am not a fan of that i am just hanging out with my cat do you have a pet turtle i am from the united states,prob_B,no es bueno quien eres no soy un fan de eso estoy pasando el rato con mi gato tienes una tortuga mascota soy de los Estados Unidos,Non bene chi sei io non sono un fan di questo sto solo uscendo con il mio gatto hai una tartaruga animale domestico io sono dagli Stati Uniti,"nicht gut wer bist du ich bin kein Fan davon, dass ich bin nur hängen mit meiner Katze haben Sie ein Haustier Schildkröte ich bin aus den Vereinigten Staaten",nie goed wie is jy ek is nie 'n fan van dat ek net hang uit met my kat het jy' n troeteldier skilpad Ek is van die verenigde state,"Нехорошо, кто ты, я не фанат того, что я просто тусуюсь с моим котом. У тебя есть питомец черепаха, я из объединённых штатов."
34,i have slave you are crazy ,prob_B,"Tengo esclavo, estás loco. ",Ho lo schiavo che sei pazzo. ,"Ich habe Sklave, du bist verrückt ",Ek het slaaf jy is mal ,"У меня есть раб, ты сумасшедший. "
35,wanna fuck you babe it is indecent unamused face,prob_B,"Quiero follarte, nena. Es indecente, cara desenfadada.",wanna cazzo you babe it is indecent unamoused face,will ficken dich babe es ist unanständig unbeschädigt gesicht,"Wil jy 'n klein kindjie hê, dit is onaangetaste gesig","Хочешь трахнуться с тобой, детка, это неприлично, безобидное лицо"
36,why not are you married  i am not married i am just a lonely person ,prob_NB,¿Por qué no estás casado? No estoy casado. Sólo soy una persona solitaria. ,Perche' non sei sposato? Non sono sposato. Sono solo una persona sola. ,Warum bist du nicht verheiratet Ich bin nicht verheiratet Ich bin nur eine einsame Person ,"Hoekom nie is jy getroud, ek is nie getroud nie, ek is net 'n eensame persoon ","Почему ты не замужем, я не замужем, я всего лишь одинокий человек. "
37,are you girl or boy  it is indecent unamused face,prob_B,¿Eres chica o chico es indecente cara inencantada,Sei ragazza o ragazzo è indecente faccia non divertita,bist du Mädchen oder Junge es ist unanständig unbeschädigtes Gesicht,"is jy 'n meisie of seun, dit is onwelvoeglike gesig","Ты или девочка, или мальчик это непристойное, безобидное лицо"
38,fuck you it is indecent unamused face,prob_B,"Que te jodan, es una cara indecente y sin gracia.",cazzo si è indecente infastidito faccia,Ficken Sie es ist unanständig unbeschädigt Gesicht,"Ag, dit is onaangetaste gesig","Да пошёл ты, это неприлично, безобидное лицо."
39,don t be such boring i wish i could eat fish but i do not like it ,prob_B,"No seas tan aburrido. Ojalá pudiera comer pescado, pero no me gusta. ","non essere così noioso vorrei poter mangiare pesce, ma non mi piace ","Ich wünschte, ich könnte Fisch essen, aber ich mag es nicht. ","Don t so vervelig wees ek wens ek kon vis eet, maar ek hou nie daarvan nie ","Не будь такой скучной, я бы хотел есть рыбу, но мне это не нравится. "
40,why  i am not sure what you mean ,prob_B,¿Por qué no estoy seguro de lo que quieres decir? ,Perche' non sono sicuro di quello che intendi? ,"Warum bin ich nicht sicher, was du meinst ",hoekom ek nie seker is wat jy bedoel nie ,"Почему я не понимаю, что ты имеешь в виду? "
41,what is your hobby  i am a closet collector and i like to play board games ,prob_PB,Cuál es tu hobby soy un coleccionista de closet y me gusta jugar juegos de mesa ,Qual è il tuo hobby sono un collezionista di armadi e mi piace giocare a giochi da tavolo ,"was ist Ihr Hobby Ich bin ein Schranksammler und ich mag es, Brettspiele zu spielen ",wat is jou stokperdjie ek is 'n dig versamelaar en ek hou van speel bord speletjies ,"Какое у тебя хобби, я коллекционер шкафа и я люблю играть в настольные игры "
42,bonjour how are you  i m doing very good how are you doing today ,prob_NB,bonjour ¿Cómo estás? Estoy muy bien. ¿Cómo estás hoy? ,bonjour come stai io sto facendo molto bene come stai facendo oggi ,"bonjour wie geht es dir sehr gut, wie geht es dir heute? ",bonjour hoe is jy i m doen baie goed hoe doen jy vandag ,"Как у тебя дела, как у меня дела сегодня? "
43,i m good thanks have you ever programmed before ,prob_NB,"Estoy bien, gracias. ¿Alguna vez has programado antes? ",I m good grazie hai mai programmato prima ,"Ich danke Ihnen, dass Sie schon einmal programmiert haben. ",i m goeie dank het jy al ooit geprogrammeer voor ,"Спасибо, что запрограммировали раньше. "
44,programmed what  no i ve not u ,prob_B,Programado que no i y not u ,,,,
45,i guess i ve not did you ever watch walking dead ,prob_NB,Supongo que no te he visto caminar muerto. ,Immagino di non aver mai guardato camminare morto. ,"Ich schätze, ich habe nie gesehen, wie du tot gewandelt hast. ",Ek dink ek het nie jy ooit kyk hoe loop dood ,"Наверное, я никогда не видела, как ты гуляешь по мёртвым. "
46,no but i ve heard a lot about it haha it sounds horrible i ll stick to sushi also try to guess my bedroom is ,prob_B,"No, pero he oído hablar mucho de ello jaja suena horrible me voy a pegar a sushi también tratar de adivinar mi dormitorio es ",no ma ho sentito molto su di esso haha suona orribile ll bastone al sushi anche cercare di indovinare la mia camera da letto è ,"Nein, aber ich habe viel davon gehört haha es klingt schrecklich i ll stick to sushi auch versuchen, mein Schlafzimmer zu raten ist ","Nee, maar ek het baie gehoor oor dit haha dit klink verskriklik ek ll plak aan sushi ook probeer raai my slaapkamer is ","Нет, но я много слышал об этом, хаха. Звучит ужасно, если я придержу суши и попытаюсь догадаться, что моя спальня - "
47,i don t know purple and lime green funny you ,prob_B,No sé morado y verde lima gracioso ,Non so viola e lime verde divertente voi ,ich weiß nicht lila und lime grün lustig dich ,Ek ken pers en kalk groen snaaks jy ,Я не знаю фиолетовых и лайм зеленых смешных тебя 
48,that a nice combination of color  yeah i can see like in front of me what are you doing ,prob_PB,que una buena combinación de color sí puedo ver como en frente de mí lo que estás haciendo ,che una bella combinazione di colore sì posso vedere come di fronte a me che cosa stai facendo ,"dass eine schöne Kombination von Farbe ja ich kann sehen, wie vor mir, was Sie tun ",dat 'n mooi kombinasie van kleur ja ek kan sien soos voor my wat jy doen ,"что прекрасное сочетание цвета да я вижу, как передо мной что ты делаешь "
49,i m cooking paella would you like some  that would be wonderful thank you for asking hows it going today speak no evil monkey,prob_NB,Estoy cocinando paella te gustaría un poco que sería maravilloso gracias por preguntar cómo va hoy no hablar mal mono,I m paella cucinare vorresti un po 'che sarebbe meraviglioso grazie per aver chiesto come va oggi non parlare scimmia cattiva,"Ich koche Paella möchten Sie einige, die wunderbar wäre Danke für die Frage, wie es geht heute sprechen kein böser Affe",Ek kook paella wil jy hê sommige wat wonderlik dankie sal wees dat jy vra hoe dit vandag gaan praat geen bose aap nie,"Я готовлю паэлью, вы бы хотели немного, что было бы замечательно поблагодарить вас за то, что вы спросили, как дела сегодня, не говорите злой обезьяны"
